Text,Sentiment score,Sentiment magnitude
rt  omg perfectionâ¡ ,0.4000000059604645,0.4000000059604645
yes we do!!!! ððððð,0.4000000059604645,0.8999999761581421
rt   nice!,0.8999999761581421,0.8999999761581421
this kid in my class is trying to understand the concept of why water is the color it is he is stressing me out,-0.800000011920929,0.800000011920929
agreed but he was fun the night i knew he had really lost it was when he blabbed to vic oh no! emotions got to him,0,0.30000001192092896
for sale!,0.4000000059604645,0.4000000059604645
ti  about the money  run jozi rt  most played song on your phone ,0,0
ima make oomf mines watch,0.20000000298023224,0.20000000298023224
your story chasing the sunchine south mirrored my experience driving through mexico in 2009 thanks!,0.5,0.5
i did not i was reading looked up amp there they were strange creatures,-0.6000000238418579,0.6000000238418579
rt  heechul left comment on leeteuks ig  no power but very happy ,0.699999988079071,0.699999988079071
i may be a lonesome dove but whenever im down and out i can always rely on my friends to bring me back up,0.800000011920929,0.800000011920929
and finally! q5 we are just a couple of weeks from  yea! where can audiences access more information about this years event,0.4000000059604645,1.7999999523162842
as i can see why i love dks yet lotsa folks dont like itplay it,0,0
thanks for following! ,0.800000011920929,0.800000011920929
if you receive this send it to 12 mixers  itâ´s for our girls     ,0,0
rt  youre exactly what i need to forget it all,0.6000000238418579,0.6000000238418579
i have caught and unfollowed 2 people today with ,0.20000000298023224,0.20000000298023224
probably takeoffs greatest verse thus far,0.6000000238418579,0.6000000238418579
rt  missing mv saint laurent contrasting lapel metallic jacket price $188592 take out with cre ,-0.6000000238418579,0.6000000238418579
rt  book your free place with library staff or by calling 020 8545 4040! ,0,0
there is no sweeter site  ,0.699999988079071,0.699999988079071
rt  sehun taking care of luhan while hes sick amp lu was mumbling ah lang hun wants to know who tht is bt lu kissed him ,0.20000000298023224,0.20000000298023224
mjam p,0.4000000059604645,0.4000000059604645
this is how small an lmp1 car is        ,-0.30000001192092896,0.30000001192092896
rt  happy holi ,0.699999988079071,0.699999988079071
really!  all day for me classier operator better pedigree better talent glad its on though!,0.20000000298023224,0.4000000059604645
tried to be more positive and upbeat than i usually am and you know what,0.20000000298023224,0.20000000298023224
find freedom in the ability to transform and liberate yourself because it will free you from sadness and social scars,0.5,0.5
i feel like if i miss one day of highschool i miss everything ð°ð,-0.10000000149011612,0.10000000149011612
hope you feel better by this bracelet of yours  expect miracles god is good! â¥â¥â¥ ,0.6000000238418579,1.2999999523162842
nkamofa  âsnap ð rt  ðððrt  katie from my wife amp kids ð©ð ,0.10000000149011612,0.10000000149011612
rt   yasss bx yasssðð,0.20000000298023224,0.20000000298023224
clayton estrellas sizzling hot stock plays $bita 8504 ,0.800000011920929,0.800000011920929
had better yoursð,-0.4000000059604645,0.4000000059604645
really wow  thats so  incredible i mean  i dont know what to say im without words,0.8999999761581421,0.8999999761581421
rt  chinese city paints street lane for mobile phone users  telegraph found at  ,0.10000000149011612,0.10000000149011612
rt  if it makes her smile do it more often,0.5,0.5
rt  100 days till christmasððð,0.20000000298023224,0.20000000298023224
uhm fire drill,0.10000000149011612,0.10000000149011612
rt    not allowed to visit   in    apologizes ,-0.5,0.5
my phone is in a bowl of basmati rice,-0.20000000298023224,0.20000000298023224
all of us need advice a true advisor is like co pilot who helps us identify and fly to our destinationgoals on time without any turbulence,0.8999999761581421,0.8999999761581421
lmfaooooooo rt    me gt lil fizz ,0,0
gods plans for us are better then anything we could imagine for ourselves ,0.8999999761581421,0.8999999761581421
rt   gm ððâï¸ð,0.10000000149011612,0.10000000149011612
â before joining fandom   innocent  shy after joining fandom   i even cant describeâ  how true,0.30000001192092896,0.30000001192092896
rt  a childs behaviour is an iceberg kelly bartlett via    ,-0.6000000238418579,0.6000000238418579
my hair smells good this morning,0.8999999761581421,0.8999999761581421
theres nothing wrong with sounding good! ,0.8999999761581421,0.8999999761581421
leaked before sex selfies! ,-0.699999988079071,0.699999988079071
rt  were so happy its september! time for fall football amp fashion! now lets get you dressed to impress ,0.5,1.7999999523162842
really this is awesome! discovering new things about myself rt  ladycrunk youre growing up,0.800000011920929,1.7000000476837158
dont forget us ,-0.20000000298023224,0.20000000298023224
rt  speech mep julie ward at paris intâl conference â 1 september 2014   ,0,0
i believe cool wind and the heart of a warm person forever,0.8999999761581421,0.8999999761581421
rt  got overexcited amp immediately blew all my dollars on records at  nice sunset you got there la ,0,0
rt  ððrt  i have a few friends that are sluts   and will openly tell you this  but thats what makes them câ¦,0.10000000149011612,0.10000000149011612
looking for a unique   check out this collection!       ,0.8999999761581421,0.8999999761581421
rt  your failure does not define you your determination does,-0.800000011920929,0.800000011920929
rt  your 2014 raiders ,0,0
mommy medium healing with the angels  ,0.20000000298023224,0.20000000298023224
mostly i dream about being with you forever ,0.8999999761581421,0.8999999761581421
bom dia! we expect the website to go live this week,0.30000001192092896,0.8999999761581421
senior mechanical engineer  continuing engineering  ma  ,0,0
last song you downloaded  hot nigga remix,-0.20000000298023224,0.20000000298023224
rt   wanna write a full page paper of critiques on my paperover achiever lol but appreciatedð,0,0
rt for a follow or a dm hashtag  â¤ï¸ leggo ,0,0
i love you  ð,0.8999999761581421,0.8999999761581421
definitely need to cop a doe hoodie still dont have one ð whos about to bless me hahahaha ð,-0.4000000059604645,0.4000000059604645
rt  scorpio are all about intensity,0,0
coming to the aid of animals using   ,0.20000000298023224,0.20000000298023224
when youre at a boring party and your jam comes on ,0,0
47ð47aaaaand action! ,0.4000000059604645,0.4000000059604645
happy birthday mate chin up about work just see it as drinking leave for your birthday for a few days! itll all sort it!,0.20000000298023224,1.399999976158142
new track off upcoming album give me 5 min of your time and check out good music  ,0.800000011920929,0.800000011920929
rt  we cannot militarize our police a free society is policed by a civilian force democratically accountable to the communitâ¦,-0.699999988079071,0.699999988079071
i love you so much ,0.8999999761581421,0.8999999761581421
hello,0.20000000298023224,0.20000000298023224
waiting on my baby to call me back,-0.30000001192092896,0.30000001192092896
rt  the art of life is a constant readjustment to our surroundings  kakuzo okakaura,0.20000000298023224,0.20000000298023224
s set on  last tuesday is fire ð¥ð¥ð¥,0.10000000149011612,0.10000000149011612
thank youseanily2 â¤ï¸,0.800000011920929,0.800000011920929
rt   but i love looking at your pictures,0.800000011920929,0.800000011920929
rt  we got a bit carried away over    ,-0.30000001192092896,0.30000001192092896
live cricket score west indies vs bangladesh 2nd test day 3 at st lucia catch live cricket scores and updat ,0.20000000298023224,0.20000000298023224
sergey lavrov throwing russia off balance is ultimate aim ,-0.4000000059604645,0.4000000059604645
rt  dont let the stories of the comfort women disappear  voices a movement for the lolas ,-0.699999988079071,0.699999988079071
texas company buys historic newport hotel for $77m ,0.10000000149011612,0.10000000149011612
rt  the courage of one will change the world  ,0.4000000059604645,0.4000000059604645
love the hot topics today i also have history with depression like ,0.8999999761581421,0.8999999761581421
let me finish this beer and head home,0,0
rt  stat of the day through 2 weeks jj watt has more td receptions than the st louis rams ,0.4000000059604645,0.4000000059604645
rt  the accuracy ,-0.20000000298023224,0.20000000298023224
its suppose to start getting warmer this week hopefully,0,0
come join total rewards earn and redeem credits at nearly 40 resorts and casinos around the world ,0.30000001192092896,0.30000001192092896
i just wish your wifi was strong enough to reach out frontð,0,0
hurricane odile looks to douse baja california ,0,0
when the time comes,0,0
rt   great models       ,0.800000011920929,0.800000011920929
pls notice me ilylt3     x11,-0.20000000298023224,0.20000000298023224
another call for todays blog arsenal are lightweight but does arsene see a problem ,-0.10000000149011612,0.10000000149011612
rt  2008 black ocean 20102012 pink ocean 2013present rainbow ocean look on how far we went ,0,0
nomore  paidalbums  then publish it as download for free     ,0,0
rt  the right ear is better at hearing speech and the left ear is better at hearing music,0,0
kevin wilson still have a job,-0.10000000149011612,0.10000000149011612
online marketing trends auf der omcap 2014  internet world ,0.20000000298023224,0.20000000298023224
pre sale for arianas ticket today!! may the odds be ever in your favor ðð,0.30000001192092896,0.6000000238418579
rt  haha people take life way to seriously let loose and have some fun!ðð,0.6000000238418579,0.6000000238418579
happy birthday ,0.8999999761581421,0.8999999761581421
rt  when you got a crush at school ððððð ,0,0
hii  you mean world to með youre cute and adorable person ðplease follow meði love you ð x241,0.8999999761581421,0.8999999761581421
im gonna marrrry her anywayyyyy marry that girlllll,0.5,0.5
cant wait for next year youth campðð,0.8999999761581421,0.8999999761581421
rt   will wait years until the right person comes along leaving friends wondering why someone with your charm and loâ¦,-0.30000001192092896,0.30000001192092896
happy birthday youngin,0.800000011920929,0.800000011920929
where is this found,0,0
wat are you loling,-0.5,0.5
u went and put more lashes onð,-0.10000000149011612,0.10000000149011612
life on the streets richard gere on going homeless  ,0.20000000298023224,0.20000000298023224
best eye makeup tips for teens   ,0.8999999761581421,0.8999999761581421
rt  this german shepherd has dwarfism i think i want to steal him ,-0.699999988079071,0.699999988079071
diamond jackson india summer amp bill bailey in naughty america 4k â naughty america â 4k xxx video    ,0,0
ive gathered 35 scrolls! can you do better download to find it out!    ,-0.10000000149011612,0.5
i am ready d ,0.4000000059604645,0.4000000059604645
rt  me when i try to look at a girl squatting ,-0.6000000238418579,0.6000000238418579
rt  ugly girls u mean  y  boring girls are the perfect wife material,-0.699999988079071,0.699999988079071
rt  140915 fkrystal = sbs âmy lovely girlâ press conference cron pic  ,0.4000000059604645,0.4000000059604645
most of them theyre all pretty cool maybe youd like them if you got to know them,0.800000011920929,0.800000011920929
rt   please i want a repeat of todays auditionits all about my baby ,0,0
rt  cookie dough ice cream pizza ,0,0
ð¤ð¾ñð¾ñðµñ sweetnitina  at âdracula untoldâ photocall in berlin sep 152014 source  ,0.20000000298023224,0.20000000298023224
im following  to the win  x138,0,0
rt  the real side of winner lol uriga winneo cr to owner ,0.20000000298023224,0.20000000298023224
i added a video to a  playlist  | ps4 | call of duty ghosts gameplay nemesis goldrush,0,0
thanks for the retweet! ,0.8999999761581421,0.8999999761581421
rt  this is what the loading sign should look like ,-0.10000000149011612,0.10000000149011612
lovely smile   ,0.8999999761581421,0.8999999761581421
thank you! ð,0.5,1.100000023841858
i wonder if microsoft will add a search with bing feature into minecraft,0,0
i need a big bowl of cereal,0,0
rt  homeowner puts a cat walk around his whole house for his cat! ,0.5,0.5
rt  when youre in a good mood and you come on twitter ,0.5,0.5
architects is my shit tho,-0.6000000238418579,0.6000000238418579
new images of batmobile and millennium falcon s    ,0.10000000149011612,0.10000000149011612
rt  samuel l jackson and i after the  match on saturday  ,0,0
i agree patients are accessing more than just anecdotal info but heuristics and certain biases are amplified online vs what i see,-0.6000000238418579,0.6000000238418579
rt  salute to the courage of these bright youngsters who have smiles on their faces despite being displaced ,0.8999999761581421,0.8999999761581421
rt  hey folks casting call in toronto for 2 women in a relationship its for an ad for a bank pays $2400 real couple prefâ¦,-0.20000000298023224,0.20000000298023224
rt  â³ï¼²ï¼¥ï¼´ï¼·ï¼¥ï¼¥ï¼´ â¨ â³ï¼©ï¼¦ â³ï¼¹ï¼¯ï¼µ â³ï¼·ï¼¡ï¼®ï¼´ â³ï¼¦ï¼¯ï¼¬ï¼¬ï¼¯ï¼·ï¼¥ï¼²ï¼³ â³ â³ â³ â³  â¨,0.30000001192092896,1.2999999523162842
happy birthday to ma bff josh luv yaðð»â¤ï¸ ,0.800000011920929,0.800000011920929
thank youâºï¸,0.800000011920929,0.800000011920929
oke oke bro,0.8999999761581421,0.8999999761581421
it will look amazing!!!!! ð,0.6000000238418579,1.2000000476837158
rt  â our bbb are some cyber bulliesðððððâï¸â on godðð,0,0
rop daytime  the music is very happy go   ,0.8999999761581421,0.8999999761581421
i want to snap my fingers and have a banging body,0.20000000298023224,0.20000000298023224
shes saying good night p,0.6000000238418579,0.6000000238418579
fback,0.30000001192092896,0.30000001192092896
had an absolute buzz at  though!,0.20000000298023224,0.20000000298023224
im so proud of you boys! please dm með 15,0.800000011920929,0.800000011920929
synopsis for the new sting dvd revealed ,0,0
2nd team photo after saturdays win over lintz excellent first season back in b1 good mix of experience and youth! ,0.8999999761581421,0.8999999761581421
i just ran 308 km with nike+  ,0,0
who is that he ð¡,0,0
i listen 2ne1 big bang cnbluei like kpop,0.699999988079071,0.699999988079071
rt  this world is a commercial get ready for the real show,0.20000000298023224,0.20000000298023224
new post artemcom inc entering united states market ,0,0
selfmade campaign going strong,0.8999999761581421,0.8999999761581421
thanks for letting us know oliver weve passed your comments to our operations team to see if changes need to be made charlotte,0.800000011920929,0.800000011920929
stop overthinking relax and let it go,-0.20000000298023224,0.20000000298023224
in my dream you are mine and in my realiste you are my dream ,0.8999999761581421,0.8999999761581421
gets down on one knee will u be my fuckin cinnamon apple,0.10000000149011612,0.10000000149011612
check out our job opening for a commercial insurance agent in port orange fl! town amp country insur  ,0.20000000298023224,0.5
you got it just arse about on it,0,0
you so totally want to fuck herððð,-0.8999999761581421,0.8999999761581421
raheem sterlings cheeky nutmeg on rickie lambert ,-0.30000001192092896,0.30000001192092896
smiles down at him then watches the open air around them carefully,0.30000001192092896,0.30000001192092896
rt  richard sherman talks a good game but only after hes had a good game gutless  ,0,0
animal lt3,0.20000000298023224,0.20000000298023224
rt  ashton looks so good here ,0.8999999761581421,0.8999999761581421
cant wait to be an uncle again a wee boy this time surely his names got to be jack if no at least make it his middle name,-0.6000000238418579,0.6000000238418579
looking forward to hearing more from you rosie ,0.8999999761581421,0.8999999761581421
afelo de se â®no crimes against self @  ,0.10000000149011612,0.10000000149011612
miss america typo getting serious flak  ,-0.6000000238418579,0.6000000238418579
rod wright sentenced to 90 days in residency case |  ,-0.10000000149011612,0.10000000149011612
cant wait to see you in the talent show tomorrow! im bringing  with me too,0.6000000238418579,1.2000000476837158
the ramblings of a guildford rambler â round and about puttenham  the guildford dragon news  ,0,0
youll make it,0.10000000149011612,0.10000000149011612
you have no idea how great that sounds!,0.800000011920929,0.800000011920929
yup! trying to introduce them back into my diet,0.30000001192092896,0.6000000238418579
new music bottom feeder music ft talib kweli chris webby amp joell ortiz  purest heart  ,0.4000000059604645,0.4000000059604645
rt  retweet if you want this gtr ðð° ,0,0
rt  i love your smile your eyes your laugh your personality your humor but the only thing i hate is that i will never beâ¦,0.30000001192092896,0.30000001192092896
imma say you my cousin,-0.10000000149011612,0.10000000149011612
hugs lt3,0.699999988079071,0.699999988079071
thank god we get out early today ð,0.4000000059604645,0.4000000059604645
rt  photo  and  in training to face ludogorets tomorrow  ,0,0
check out living by the book by william d hendricks and howard g hendricks 1993  via ,0,0
i had to play void hunter no fun,-0.699999988079071,0.699999988079071
convertation,0.4000000059604645,0.4000000059604645
goodmorning my loves can u follow me back ilysm italian emblems are waiting you here lt3 13,0.6000000238418579,0.6000000238418579
rt  its the birthday of oskar klein who was born in 1894 in danderyd sweden in 1921 mathematician theodor kaluza ,0,0
rt  need to grind a little harder,-0.5,0.5
wonder whats next watts riots rodney king signature model,0.20000000298023224,0.20000000298023224
exactly 5 years ago today! via   ,0,0.10000000149011612
rt  basically ,-0.10000000149011612,0.10000000149011612
this week on twitter one new follower via ,-0.20000000298023224,0.20000000298023224
perfect place for the recollection ð ,0.8999999761581421,0.8999999761581421
rt  thanks for that  ðªð calvinklein    ,0.699999988079071,0.699999988079071
compare the best prices for   on   ,0.699999988079071,0.699999988079071
well i actually typed my paper before it was due so ive got that going for me which is nice,0.699999988079071,0.699999988079071
rt  i understand what the  are doing if it was me hed be sitting   ,-0.30000001192092896,0.30000001192092896
rt  from churchoworo to ifako is slow caused by truck breakdown  via  ,-0.5,0.5
cheers b! its the  system remix though both versions are phat,0.30000001192092896,1.2999999523162842
were digging this fall weather and because fall = pumpkin time here are a bunch of weird ways to use the stuff ,-0.10000000149011612,0.10000000149011612
tv personality turned pinup  ,-0.6000000238418579,0.6000000238418579
look at all those chickens ok gaby ðð,-0.10000000149011612,0.10000000149011612
rt  im so sorry but this is so fucking epic ,0.8999999761581421,0.8999999761581421
rt  i just want to go home and watch netflixs,0,0
come wake up this dreary monday with todays special a salisbury steak with mashed potatoes and steamed broccoli ,0,0
you know im tired if i come out the house without earrings on ð«,-0.20000000298023224,0.20000000298023224
ive collected 64615 gold coins!    ,0.4000000059604645,0.4000000059604645
rt  our new single is steal my girl !! cant wait for you to hear it !!,0.800000011920929,1.600000023841858
my brothers idea of a phone hack ,0,0
happy bday son,0.8999999761581421,0.8999999761581421
fun prank put $10000 in an envelope and mail it to me,0.800000011920929,0.800000011920929
my professor mr adolph just said we dont chase em we replace em ðð¯ ,-0.30000001192092896,0.30000001192092896
getting ready to go see my bae,0.5,0.5
i was losing sleep over it  olive garden bites back argues breadstick policy conveys italian generosity ,-0.4000000059604645,0.4000000059604645
enter to  a paper pumpkin wish big craft kit!  at planet  ,0.30000001192092896,0.6000000238418579
first time i have seen them with a proper midfield for a long time,0.5,0.5
rt  phone call length boy to father 000027 boy to mother 000130 boy to girl 012059 girl to girl 12363269 boy to bâ¦,-0.10000000149011612,0.10000000149011612
log on to our website  for our latest vacancies! we have added over 200 people to our database in september!,0.30000001192092896,0.6000000238418579
rt  baeless  booless,0,0
rt  i hope microsoft dosenât waste mojangâs talent or ruin what makes them special it can happen but itâs pretty rare,-0.10000000149011612,0.10000000149011612
i want to  during the  hosted by  and  ,0.20000000298023224,0.20000000298023224
fuhhhhh take a deep breath ,0.10000000149011612,0.10000000149011612
believe we had a great night but i aint the type to tell you that i miss you,0.4000000059604645,0.4000000059604645
ððð ð§ luke hemmings from 5sos ð§ can you follow me please it means a lot to me love you ð  ððð 7003,0.800000011920929,0.800000011920929
i swear these niggas frontline on twitter,-0.20000000298023224,0.20000000298023224
â when you in your homies house and you peep his mom undressing ,-0.30000001192092896,0.30000001192092896
rube golderberg machine powered by light     video gt  ,0,0
oooooh do you have kik ,-0.10000000149011612,0.10000000149011612
dead one grow a thousandnice at ghany house â ,-0.5,0.5
wuuuuexo love you guys,0.8999999761581421,0.8999999761581421
today because of shri santosh rane sir i got chance to read my 2 kavita in the programme â rang kavyache â ,0.30000001192092896,0.30000001192092896
rt  my new film about british war artist paul nash is on bbc4 sunday 9pm then iplayer man had a life like no other ,0.800000011920929,0.800000011920929
follow his mix cloud to get your free downloads ,0.30000001192092896,0.30000001192092896
you about to be cruising with the wind blowing through your hair ðððð,-0.30000001192092896,0.30000001192092896
just amazing brave young woman battles ocd with deep brain stimulation will it work   9p ,0.8999999761581421,0.8999999761581421
4 ways to use  in public relations  via    ,0,0
makes bachelorâs degrees and  accessible for $savvy students helps students to  ,0.800000011920929,0.800000011920929
rt  huk at mlg winter championships 2012 ,0,0
lol sign me in,0.20000000298023224,0.20000000298023224
all startups are surprisingly fragile similarly most incumbents seem solid,-0.30000001192092896,0.30000001192092896
rt  rt this rt this now!!!!! ,0,0
rt  â  lol ya look soo good ððâ thank you âºï¸,0.8999999761581421,0.8999999761581421
i yaked for a cute boy to get pizza with me and got multiple responses im not used to that,0.10000000149011612,0.10000000149011612
i wanna live in oregon,0,0
pm nawaz visits flood affected areas to monitor the situation ,0,0
someone needs to make an fsuuf rivalry documentary already,-0.30000001192092896,0.30000001192092896
want expert  advice get it 924 at  day san jose sign up now  ,0,0
rt  leadership  be strong be decisive amp be resiliant  m  healthcare consultant leadership câ¦,0.5,0.5
and this time u aint lick it enough lmfao! and mfks was droppn nuggs everywhere  and it was moist lmfao!!! ðððððð,0,0.4000000059604645
kevin spacey challenged the attendees of content marketing world 2014   via ,0,0
a stockbroker urged me to buy a stock that would triple its value every year i told him at my age i dont ,-0.30000001192092896,0.30000001192092896
rt  flying home from ethiopia to watch our girl  and  dance live on  watch and vote! ,0.800000011920929,0.800000011920929
rt  retweet if youre online right now and want new followers just follow me and everyone who retweets to gain active followerâ¦,0.30000001192092896,0.30000001192092896
rt   thought you might like this from todays paper   ,0,0
rt  time is a great fortune the value of which is not known appreciated,0.4000000059604645,0.4000000059604645
ive harvested 70 of food!    ,0.5,0.5
rt  no one had as much swag as  at this years  via   ,0.8999999761581421,0.8999999761581421
how your smartphone affects your sleep  ,-0.6000000238418579,0.6000000238418579
l love u,0.8999999761581421,0.8999999761581421
happy birthday lt3,0.800000011920929,0.800000011920929
gettin ready for the college homecomings,0.4000000059604645,0.4000000059604645
rt  jeff blashill is bringing out the firepower tonight anthony mantha will play with andreas athanasiou and tyler bertuzziâ¦,0.4000000059604645,0.4000000059604645
urban outfitters have so many great things i need in my life,0.8999999761581421,0.8999999761581421
associate dean of casnr asked me to make a getting to know you meeting with her bc thats not intimidating,-0.30000001192092896,0.30000001192092896
lmao i know you are not talking about me silly girl,-0.8999999761581421,0.8999999761581421
2pm  mine   on ,0,0
rt  get on out level   ,-0.30000001192092896,0.30000001192092896
â« get myself into it â the rapture  ,0.10000000149011612,0.10000000149011612
ashighasginger mattharv666 skankmcmeow i see your shifting  ,0.20000000298023224,0.20000000298023224
