Text,Sentiment score,Sentiment magnitude
luke will u come get me so i dont have to fo to school and we x oooooo uld cuddle and eat sandwiches and watch movies,-0.10000000149011612,0.10000000149011612
rt  lycanatics gairanod international ,0.10000000149011612,0.10000000149011612
r5  i want you bad,-0.30000001192092896,0.30000001192092896
rt  saatchi online artist maurice sapiro painting sunset reflected  via  ,0.10000000149011612,0.10000000149011612
concert | 3rd of october | federal palace hotel |    ,0,0
sometimes when you love people you want to believe theyâre good,0.5,0.5
kfb dear,0,0
how can you be motivated â only by my mom ,-0.4000000059604645,0.4000000059604645
follow back pls x,-0.20000000298023224,0.20000000298023224
happiness is forgotten pocket moneyð,-0.20000000298023224,0.20000000298023224
im at maltepe in ä°stanbul ,0.30000001192092896,0.30000001192092896
ð¥neeeeww musicð¥ mad j   prod by  official audio    ð¥ð¥ð¯ð¢ð¢,0.10000000149011612,0.10000000149011612
rt  you have enemies good that means youve stood up for something in your life,-0.4000000059604645,0.4000000059604645
i love my bros,0.8999999761581421,0.8999999761581421
rt  whether yall have been here from the beginning of  or binge watched it this summer thanks spnfamily for ,0.4000000059604645,0.4000000059604645
let the past be the past,-0.30000001192092896,0.30000001192092896
rt  omg love this gif ot4! ððð rt omg these dorks!!!! xd ,0.699999988079071,2.200000047683716
subtweeting tweets that reference a person indirectly,-0.4000000059604645,0.4000000059604645
although you may start the day in a rather easygoing mood a f more for sagittarius ,0.20000000298023224,0.20000000298023224
pete what are these ,-0.4000000059604645,0.4000000059604645
small biz  start up want to reach 1000s of new  clients daily ,0,0
choosing the goodness nursing run multiple series until feed on lmyhxqn,0.10000000149011612,0.10000000149011612
err mer gherd im back at college yo! so far its been a good day! better than i expected  ,0.8999999761581421,1.7999999523162842
the empire strikes back poster from poland ,0,0
a gentle reminder ,0.5,0.5
so glad to hear that david! i love having you join us in the morning ,0.8999999761581421,1.899999976158142
team member  works his magic ,0.699999988079071,0.699999988079071
youve already made friends which is the hard part really and plus youll have friendly faces me woo around campus too!,0.8999999761581421,0.8999999761581421
yes guys i was sub tweetinggg,0.20000000298023224,0.20000000298023224
for now anyway until i get a better rapport with the editors,-0.10000000149011612,0.10000000149011612
rt  i always thought this was a sign !!!! taal volcano on roar mv    ,0,0.30000001192092896
good he laughed softly and he stopped splashing her,0.8999999761581421,0.8999999761581421
rt  it was all smiles at old trafford as  beat  40 match report and pics here   ,0.4000000059604645,0.4000000059604645
rt  its not glass but a 3d painting  ,-0.20000000298023224,0.20000000298023224
24hr streamathon! minecraft vanilla 18 achievement hunt!  ,0.30000001192092896,0.699999988079071
the women consent to work in that industry its not objectifying them at all,-0.5,0.5
canon and stella mccartney reveal limited edition camera bag canon and stella m  ,0.5,0.5
cool chicago weather streak a recordsetter the cool september weather moved into recordsetting territory th ,0.800000011920929,0.800000011920929
rt  walking while texting chinese city unveils special lane for cellphone addicts  ,0,0
some pple on here secondary school kawaii aka gama amma they be actin like some phd holders haba manaah,-0.20000000298023224,0.20000000298023224
rt   says angel di maria is one of the best players in the world and praised  debutants v qpr ,0.699999988079071,0.699999988079071
rt  so much fun at    another amazing event ðð,0.8999999761581421,0.8999999761581421
any chance of one of your marshmallow tea cakes on my birthday in late september i can stick a candle in it!,0.699999988079071,0.699999988079071
keep calm and love miley gt        ,0.800000011920929,0.800000011920929
this is the 1st time i could see ed!i love him and his music so muchðplease pick me! x94,0.6000000238418579,1.2999999523162842
mission accomplishedâ¢ goin back to bedâ°,0,0
rt  finevictorianruby3carataquamarineseedpearlartnouveau15kgoldpendant ,0.10000000149011612,0.10000000149011612
yesss miss zaman,-0.4000000059604645,0.4000000059604645
rt  happy birfffdaaay  âºï¸ð ,0.699999988079071,0.699999988079071
some of your tweets make me laugh a lot,0.8999999761581421,0.8999999761581421
has pardew gone yet,-0.10000000149011612,0.10000000149011612
at least i get to go home and get my boots now except i cant wear pants ,-0.30000001192092896,0.30000001192092896
com 433 s01 has 68 open spots,0.10000000149011612,0.10000000149011612
rt    did you need one,0.10000000149011612,0.10000000149011612
ahahaha!!! have fun dear,0.6000000238418579,1.2999999523162842
closed sell 15 lots eurusd 129227 for +45 pips total for today +2479 pips   ,-0.4000000059604645,0.4000000059604645
rt  harry mouthed youre pretty to a fan in the crowd but she didnt understand so harry used his mic this girl wins at life,-0.10000000149011612,0.10000000149011612
whoops got my spelling wrong ,-0.6000000238418579,0.6000000238418579
you the one i need ðð â« love on top by  â ,0.8999999761581421,0.8999999761581421
rt  work hard stay humble,0.800000011920929,0.800000011920929
serena williams new beach photos ,0.800000011920929,0.800000011920929
maybe she knows something,0,0
it happens ,0,0
rt  wow! just the logo created so much of buzz wonder what a buzz the  team will create when they take the fieldâ¦,0.800000011920929,1.600000023841858
iphone 6 case  ringke fusion iphone 6 47 case dust capdropâ¦ ,0,0
rt  weâre giving away tix to  presents   soundcheck party at the barclays in 15 mins! ,0.800000011920929,0.800000011920929
you could stir up trouble today by imagining people arent tel more for cancer ,-0.699999988079071,0.699999988079071
rt  we stock a wide variety of  amp  aids at any one time all available for free next day delivery ,0.30000001192092896,0.30000001192092896
rt  rt for an indirect mbf,-0.10000000149011612,0.10000000149011612
rt  the supreme accomplishment is to blur the line between work and play arnold j toynbee,0,0
rt  the sea of red the skyline backdrop  all of this is glorious ,0.8999999761581421,0.8999999761581421
$ahp  ashford prime declares dividend for third quarter of 2014 ,0,0
hehe alright  â owrayt ,0.699999988079071,0.699999988079071
happy birthday taylor ðððððð,0.8999999761581421,0.8999999761581421
choose our next figure kit! ,0.20000000298023224,0.20000000298023224
high risk credit card processing ,-0.5,0.5
thank you for the follow i send greetings from japan ï¼sweet dreamsï¼ good night î¼î¼âª ,0.8999999761581421,0.8999999761581421
lets get it first stats exam today,0.20000000298023224,0.20000000298023224
happy 21st pretty girl!!  have a good one ð½ð,0.800000011920929,1.7000000476837158
rt  breastfeeding burns an average of 500 calories a day,-0.5,0.5
rt  kim woo bin surprises and makes lee jong suk tear up at his fanmeet  ,-0.30000001192092896,0.30000001192092896
can acupuncture help treat depression â» soothe | pain and stress management | acupuncture in ,0.30000001192092896,0.30000001192092896
really not replying,-0.800000011920929,0.800000011920929
rt  ive had a great time with aubri in my room this weekendim so ready to take her home,0.8999999761581421,0.8999999761581421
he who is the glory of israel does not lie or change his mind for he is not a man that he should change his mind 1samuel 1529,-0.800000011920929,0.800000011920929
just completed a 008 mi walk with  check it out!  ,0.699999988079071,0.699999988079071
fback ,0.30000001192092896,0.30000001192092896
ahh okayâºï¸thanksð,0.20000000298023224,0.20000000298023224
rt   kpopers go follow    amp join theirs ga gift cek fav fanbase ,0.699999988079071,0.699999988079071
dream needs to be decoratedrhapsody,-0.30000001192092896,0.30000001192092896
rt  stunning frankfurt rights guide in well done team! ,0.8999999761581421,0.8999999761581421
its still good to come top though i think if we had walsh lomax and wilkin we would have a great chance of winning it,0.6000000238418579,0.6000000238418579
oh nice d since man man ha ni came out but only been active for comebacks this year ,-0.30000001192092896,0.30000001192092896
rt  people will judge you no matter what so be who you wanna be,-0.6000000238418579,0.6000000238418579
rt  lyxor says hedge funds reversed massive long positions on sterling by august now net short ,-0.6000000238418579,0.6000000238418579
bbc news  us and uk spy agencies have access to german telecoms ,-0.5,0.5
with  firgiawan  and 5 others at perumahan staff pt kts palm oil â ,0,0
no matter what you do or say and your family i will always love you,0.8999999761581421,0.8999999761581421
lift intro avicii vevo lift brought   ,0,0
rt  allkpop chansung amp go jun hees 19+ movie red carpet releases hilariously naughty trailer  httâ¦,0,0
photoset ,0.30000001192092896,0.30000001192092896
rt  real niggas birthday ðð ðð ð september ð ð july ð ð december ð ð october ð ð june ð ð january ð ð may ð ð april ð ð febâ¦,0.20000000298023224,0.20000000298023224
rt  + being a fan is being here whenever they need us to be being a fan is supporting them no matter what being a fan is abâ¦,0.6000000238418579,0.6000000238418579
mtm brownsville  gateway hrs 24 hrsday 9152014 pov lns at 600 am cdt no delay 4 lanes open readylane at 60 ,0.10000000149011612,0.10000000149011612
ready for this one  chocolate  with all the toppings! ,0.8999999761581421,0.8999999761581421
senior project managerproject director  ,0,0
could you use a bar cart in the office,-0.10000000149011612,0.10000000149011612
whut haha,0.699999988079071,0.699999988079071
rt  getting control of energy   reviews new  pamphlet on public ownership of the big six ,0,0
do you have plans after,0,0
jut found a pic that is absolute truth!!!,0.4000000059604645,0.4000000059604645
rt  sunday night at the palladium just starting  tune in too  to see our performance!! x leigh,0.20000000298023224,0.4000000059604645
such an exciting read ive read so many negatives things on the energy revolution especially on the co2 output side,0.8999999761581421,0.8999999761581421
rt  rt  info 2pm to appear on sbs mtv the show on 923 instead of 916 due to the broadcaster circumstance crâ¦,-0.30000001192092896,0.30000001192092896
starting another week ready for the weekend,0.6000000238418579,0.6000000238418579
not really,-0.699999988079071,0.699999988079071
haha songs available in itunes ani via apple store,0.20000000298023224,0.20000000298023224
only reason im going to school  cause bae there ð,-0.30000001192092896,0.30000001192092896
someone might try to persuade you that youre doing the right  more for virgo ,-0.6000000238418579,0.6000000238418579
also yes,0.4000000059604645,0.4000000059604645
miss america contestant slapped a shark as a kid greatest living american probably during sunday nights  ,-0.4000000059604645,0.4000000059604645
well alright i guess its be mean to kayla today,-0.30000001192092896,0.30000001192092896
have a nice day too ð,0.8999999761581421,0.8999999761581421
rt  you have always shown us the right way thanks for being our guide and mentor ,0.8999999761581421,0.8999999761581421
stacked beneath a pentagonal roof canopy the staggered program cascades across the site f  via ,-0.30000001192092896,0.30000001192092896
we second that! congrats always love what you guys bring,0.6000000238418579,1.2999999523162842
i can go under the bridge! have you already discovered this location    ,0.4000000059604645,0.800000011920929
rt    great show! thank you for the vip view    ,0.8999999761581421,1.7999999523162842
ð¸ð­ðð­ð luke hemmings from 5sosð are you the sun bc you light up my world every dayâï¸ pls follow með ilysmð  ðð­ðð­ð  luke,0.10000000149011612,0.10000000149011612
rt     concerto pour demain   katharine hepburn 1947 h stradling  ,0.10000000149011612,0.10000000149011612
hannemann mounts return amid votersâ âunhappinessâ ,0,0
where in  is doing the best  at the moment ,0.5,0.5
rt  guardian premier league 10 talking points from the weekends action chelsea look the finished article in att ,0.10000000149011612,0.10000000149011612
you may be operating under the illusion that whatever you crea more for libra ,-0.5,0.5
but that character syafiq and thomas paling comel kan like i ship diorg so hard ð,0.10000000149011612,0.10000000149011612
jop weddings rule,0.30000001192092896,0.30000001192092896
rt   from above! what an amazing city!   ,0.5,1
rt  the best way to get the right answer on the internet is not to ask a question itâs to post the wrong answer,0,0
finally wearing jackets,0.699999988079071,0.699999988079071
so even though my great grandpa hates ut im touring there and might go,0.4000000059604645,0.4000000059604645
congrats   picked your tweet as tweet of the day ,0.8999999761581421,0.8999999761581421
rt  18 boram is the oldest but look like the maknae ,0.20000000298023224,0.20000000298023224
k is k  hoe na hoe  pussy is pussy  money is money,-0.10000000149011612,0.10000000149011612
its upto pakistan to bring criminal like hafiz saeed to book mea sir jhukne nahi denge,-0.6000000238418579,0.6000000238418579
you know lots of people want to earn a living  like artists who also contribute to our way of life,0.6000000238418579,0.6000000238418579
one person followed me and 2 people unfollowed me  automatically checked by ,-0.699999988079071,0.699999988079071
i know right! lets make sure everyone knows it too share it everywhere!   ,0.6000000238418579,1.2000000476837158
add photo i think ,0,0
dont know someone had retweeted might be an old tweet,-0.5,0.5
i see  everywhere i go lol,0.8999999761581421,0.8999999761581421
rt  with their sunbaes consent d ,0,0
8th spot nw! boom panes! â¢ nash aguas our loving prince,0.699999988079071,1.5
rt  if male video game characters were dressed like female characters ,0,0
rt  uk! 1ds first single  from the new album  is on preorder right now out 19th october in the uk! ,0.30000001192092896,0.6000000238418579
rt  miss you  will you be with us    ,0.8999999761581421,0.8999999761581421
your hair is so soft,0.8999999761581421,0.8999999761581421
paper! snow! a ghost!  joey,0,1.2000000476837158
rt   aww thanks,0.699999988079071,0.699999988079071
my last rt ,-0.4000000059604645,0.4000000059604645
id like to cure your glossophobia!     ,0.4000000059604645,0.4000000059604645
rt  and on that note im off to get a manicure peaaaaccceeeeeee outtttttt drops the mic,-0.20000000298023224,0.20000000298023224
who got u mad,-0.800000011920929,0.800000011920929
mr tirso cruz iii and  reunited   ðððð,0.20000000298023224,0.20000000298023224
collision  sb at queen st brampton 2 vehicles blocking the right lane no injuries tow truck at scene,-0.4000000059604645,0.4000000059604645
your child is 11 years old theres no need to park your car and walk him into the school,-0.20000000298023224,0.20000000298023224
rt  iphone 6 plus officially ordered âï¸,0,0
mist amp drizzle up here on tyneside !! x,0,0
keep t,0,0
rt  is this family home in  too minimal or just right  ,0.30000001192092896,0.30000001192092896
todays soups are white cheddar poblano or chili! our favorite is mixing them together so come in and grab a cup or bowl!,0.5,1.100000023841858
rt  when the hypest of moments come so do the gifs ,-0.10000000149011612,0.10000000149011612
happy birthday  youre beautiful god bless you and that lovely daughter of yours and i wish you nothing but happiness,0.8999999761581421,0.8999999761581421
cisco 3750 super switch stackwise configuration cisco stackwise and cisco stackwise plus technologies ar ,0.30000001192092896,0.30000001192092896
rt  tt ww 0535 â  5 6danielandkathryn the unkabogable tandem 7always smile loisa,0.30000001192092896,0.30000001192092896
hahaha my email was locked out so thats why i havent sent them yet,-0.5,0.5
toot,0.30000001192092896,0.30000001192092896
youre welcome thanks for your follow!,0.8999999761581421,0.8999999761581421
rt  thank you god for waking me up this morningâðððð,0.8999999761581421,0.8999999761581421
we hail smad for the k 40 p50 u40 minimum and 200 maximum number of items in our exam wohoooooo!!,0.4000000059604645,0.4000000059604645
yoga festival comes to canalside  wgrztv ,0.10000000149011612,0.10000000149011612
rt  get to see my mom amp skylynn for the first time in 3 months ð,0.5,0.5
is he doing it out of spite another beheading another obama golf game even piers morgan weighs in  ,-0.30000001192092896,0.30000001192092896
please rt ifu want thisand write your opnionlt3,-0.4000000059604645,0.4000000059604645
hehe my collegue just warned me about walking in there with less than 10k ,0.30000001192092896,0.30000001192092896
happy birthday agatha christie! were celebrating with 12 price sale on murder on the orient express boomerang! gtgt ,0.30000001192092896,1.7000000476837158
rt  appreciate her before she leaves yo ass,0.10000000149011612,0.10000000149011612
rt  caution debris on the bayside bridge,-0.20000000298023224,0.20000000298023224
just let the hatred go dont have anything against no one be good amp love love conquers all,-0.5,0.5
rt  $avnr positive phase ii trial results for avp923 in treatment of agitation in patients with alzheimers disease ,0.4000000059604645,0.4000000059604645
vizzywig 4k app enables 4k video recording on your iphone 5s for $1000 ,0.30000001192092896,0.30000001192092896
rt  sept 2014 15 retweet this to enter our â£20 amazon voucher competition tampc on website  via â¦,0,0
ð·  ð· ðhey sunshineð ð can you take 2 seconds and follow me ð  amp ð  ð ð¸ thank you loveð¸x8492,0.20000000298023224,0.699999988079071
please followð© ,0,0
good night,0.8999999761581421,0.8999999761581421
dat and i are getting breakfast to make this work day less painful,0.30000001192092896,0.30000001192092896
iphone 6 vs samsung galaxy alpha â progress vs stagnation  load the game load the gameiphone 6 vs samsung ga ,-0.30000001192092896,0.30000001192092896
more heavy rain and flooding possible in the southwest ,-0.4000000059604645,0.4000000059604645
cmonseriouslywhats in ur wallet  will u share bxbz8g ,-0.20000000298023224,0.20000000298023224
youus welcomee my girl! ðð,0.30000001192092896,0.699999988079071
rt  shamsuzzaman said a sign of the will for lord the holy king is a prevention from the hindrances of life and fromâ¦,0.10000000149011612,0.10000000149011612
alright,0.5,0.5
bread winner   tweet,0.30000001192092896,0.30000001192092896
qaqc engineer at emerson ,0,0
im at magic kingdomâ® park   in lake buena vista fl ,0.10000000149011612,0.10000000149011612
rt  pray my little sister alright ,0.30000001192092896,0.30000001192092896
rt  tuq did well to withdraw currency related illegal call he should now roll back his illegal dharna as well,-0.20000000298023224,0.20000000298023224
house agrees to oil lifting target of 900 thousand bpd ,0.30000001192092896,0.30000001192092896
i appreciate those who appreciate me! ,0.8999999761581421,0.8999999761581421
5 reasons your favorite anonymous crypto isnât anonymous here are 5 reasons why your favorite anonymous crypt ,0,0
interesting ,0.8999999761581421,0.8999999761581421
invictus games ðð,0.4000000059604645,0.4000000059604645
if you dont think this guy is cute i think you have eye problems  ,0,0
my aunt on go !ð,0.6000000238418579,0.6000000238418579
i would to go to rio,-0.10000000149011612,0.10000000149011612
rt  apple confirms recordbreaking iphone 6 and 6 plus preorders with four million orders in 24 hours  byâ¦,0.10000000149011612,0.10000000149011612
am doing both ðð,0.10000000149011612,0.10000000149011612
rt   banger after banger today bill wicked show!!,0.800000011920929,0.800000011920929
but i wont have too much work to do and im not too bad am i,-0.20000000298023224,0.20000000298023224
rt  this morning i was lucky enough to go on bbc breakfast amp talk about my youtube videosbook! ,0.8999999761581421,0.8999999761581421
rt  is history made by politicians or by ordinary people taking action a report from the nhs jarrow march ,-0.10000000149011612,0.10000000149011612
i met this guy beforeamp had no idea he was a  wrestler!!lmao ! hes actually very nice   ,0.30000001192092896,1.100000023841858
thanks to all for  this week well be sending emails later to let you know of any tweets you abandoned,-0.20000000298023224,0.20000000298023224
zdoom projects â¢ re mod download broken request reuploads here ,-0.30000001192092896,0.30000001192092896
i think you have to delete it on your laptop then sync with your phone,-0.5,0.5
rt   await rescue   everyone you know on    ,0.4000000059604645,0.4000000059604645
rt  its a girl!  juni gave birth to a calf yesterday both mom and baby are doing great ,0.5,1.100000023841858
ð¿ð»ð¿ please choose me to meet ed it would make my birthday the best i have ever had!!!!   ð¿ð»ð¿ 66,0.5,1.100000023841858
hey listen! its not so happy but still happy 15th =,0.30000001192092896,0.800000011920929
the bliss of cancer  ,0,0
his brakes were definitely not rubbing ,-0.20000000298023224,0.20000000298023224
its good morning text time ðð¬,0.6000000238418579,0.6000000238418579
blueberry and baret in france from rescue pup to muse  ,0.10000000149011612,0.10000000149011612
rt  i love all of him ð ,0.8999999761581421,0.8999999761581421
god is always good,0.8999999761581421,0.8999999761581421
he knows he cant come in so he just waits at the door until i get up to get them food ,-0.20000000298023224,0.20000000298023224
sounds like coach lew ðð,-0.4000000059604645,0.4000000059604645
it would make niall ferguson sad is one of the best arguments i can think of for voting yes,0.4000000059604645,0.4000000059604645
âretweetifyouneedfollowersâ 0829,0.20000000298023224,0.20000000298023224
cuz im bouta make a lot of shit,-0.699999988079071,0.699999988079071
i should have said please there please,-0.10000000149011612,0.10000000149011612
rt  happiness is a shadow if you chase it it moves further away but if you turn to make others happy it will follow you,0,0
rt  new | when trusting god is all youve got  ,0,0
even after all that time well it clicked just like before maybe a little more â¥,0.20000000298023224,0.20000000298023224
long day ahead of me but ready to take on the challenge!,0.8999999761581421,0.8999999761581421
hey  renewable energy is mystification of thermodynamics  ,0,0
rt  there are now thousands of public uml models available at   via ,0.10000000149011612,0.10000000149011612
its all about having the right people around you,0.20000000298023224,0.20000000298023224
he dances like a 3 year old ,0,0
12 also speaks directly to western citizens  why the islamic state brought beheading videos back  via ,0,0
hi in your intro to the sexy librarians big book of erotica you quote stephen king wheres the quote from please ,0.10000000149011612,0.10000000149011612
rt   we are â£2000 short of our â£6350 goal to get little destiny her wheelchair just a â£1doll ,-0.4000000059604645,0.4000000059604645
hello  i love you so much youre the best â¡ can you follow me please x580,0.8999999761581421,0.8999999761581421
budget shortfalls to defendprivatization privatization of infrastructure services in the transport electric and sanitation ,0,0
once we can ask agree donald glove is a genius we will finally understand world peace,0.800000011920929,0.800000011920929
rt  big bang theory and creation what to believe in  ,0.699999988079071,0.699999988079071
has the city inspected that building recently it looks like its going to fall down while grandma is looking for a sofa,-0.6000000238418579,0.6000000238418579
exposed did you know dammy krane has a son â see the cute boyâ¦ photo  via ,0.20000000298023224,0.20000000298023224
fact 14 billion people around the world live on $125 a day 70 of this group is made up of girls and women,-0.30000001192092896,0.30000001192092896
holdin strong on hunter takin one from  i like the cut of his jib,0.8999999761581421,0.8999999761581421
emotionally im in pain mentally im depressed spiritually im stressed physically i smile,0,0
rt  the one and only  s new album is available for pre order its amazing !  ,0.800000011920929,0.800000011920929
rt  what is with liams arm ,0,0
was on the phone with  yesterday we concluded we both missed you figured youd like to know that,-0.30000001192092896,0.30000001192092896
the sexiest bassist there is or will ever be  ,0,0
you have me laughing my ass off todayi love you chickster! ,0.8999999761581421,0.8999999761581421
i wanna see abel on the tv again all cute and stuff  ,0.800000011920929,0.800000011920929
im wearing harrys invisible cloak,-0.20000000298023224,0.20000000298023224
rt  tell em you wont make it,-0.5,0.5
rt  defense of civilization against  a coalition of the unwilling and incapable being lead from behind by the incompâ¦,-0.5,0.5
i am broadcasting live at  come and check it out!,0.800000011920929,0.800000011920929
