Text,Sentiment score,Sentiment magnitude
its a beautiful thing â the boi  got some loyal fans yall sheeeshh!!â,0.8999999761581421,0.8999999761581421
rt  rush hour   size 24inx16in â£8500      ,0,0
rt  incoming freshman be like ,0.20000000298023224,0.20000000298023224
im sure ill be here to go see that with d i hopeeee,0.699999988079071,0.699999988079071
it is an unexpected surprise yesterday sad story but shes ok ð,0.30000001192092896,0.30000001192092896
good morning  join  amp  for  for the news and weather where you live watch online ,0.699999988079071,0.699999988079071
nuevo en  dirty work link ,-0.800000011920929,0.800000011920929
rt  lol gd going down while dara with her biiiggg mic is going up rt  dapak ððð i c u dara ððð ,0.20000000298023224,0.20000000298023224
theresa may steve mcguirk amp ali parsa 3 people whove shaped public service   ,0,0
rt  the more i work with social media the more i feel everyone in this industry should read the advertising classics,0.5,0.5
rt   your concert is like a full on workout but its a fun workout,0.8999999761581421,0.8999999761581421
rt  who remembers this prickð ,0,0
rt  â¼ï¸â¼ï¸â¼ï¸â¼ï¸â¼ï¸â¼ï¸â¼ï¸â¼ï¸â¼ï¸â¼ï¸â¼ï¸ please follow her  shes your biggest fan do it for her please  â¼ï¸â¼ï¸â¼ï¸â¼ï¸â¦,0.6000000238418579,0.6000000238418579
the heat was pretty good and funny maybe not as funny as most made it seem to be but very good,0.699999988079071,0.699999988079071
good mate cheers ð» lapping up the sunwalking on the beaches looking at the peacheshowaya ,0.8999999761581421,0.8999999761581421
rt  there is my gift for guys!   ,0.8999999761581421,0.8999999761581421
goodnight danky ðð,0.20000000298023224,0.20000000298023224
is there a list of where the showers are on campus makes my cycle commute a lot happier when theres a shower at the end,0.5,0.5
rt   head of uk audiences network coordinator amp content editor uk auds coordinator ops coordinator ,0,0
what !,0.10000000149011612,0.10000000149011612
another hour! its september 15 2014 at 0602pmfxxcvj,-0.20000000298023224,0.6000000238418579
costa is off to a flyer but liverpool and man city stars are still good bets for top scorer   ,0.6000000238418579,0.6000000238418579
word,0,0
runnin runnin runnin run,0,0
gotcha!,0.5,0.5
r2be a prayer,0.30000001192092896,0.30000001192092896
what am i going to do with all these awful jumpers then oh dear never mind you are marvellous,-0.30000001192092896,0.30000001192092896
rt  reputation is what men and women think of us character is what god and angels know of us  thomas paine ,0.5,0.5
rt  the first 1000  part 1 lessons learned on the path to building an authors following   ,0.30000001192092896,0.30000001192092896
ashya proton beam sessions begin brain tumour patient ashya king is undergoing his first proton beam treatmen ,0,0
rt  hello world just want to let you guys know that a new song that i composed will be played for theâ¦ ,0.5,0.5
rt  wishful thinking for  morning     ,0.4000000059604645,0.4000000059604645
yesterday is but todayï¿½s memory and tomorrow is todayï¿½s dream,0.30000001192092896,0.30000001192092896
reply to    wowowowi want to joind p â¥â¥ ,0,0
ive just entered a competition on julies notebook to win lilys kitchen dog food from  ,0.20000000298023224,0.20000000298023224
jonathan reaffirms credible elections in 2015 | pm news nigeria ,0.30000001192092896,0.30000001192092896
egypts most prominent activist released on bail egypts most prominent activis  ,0,0
rt thornalan  absolute perfectionism involves infinite recursion to release your game youll need to stop somewhere,-0.699999988079071,0.699999988079071
india to grow at 5 6 in fy15 rate cuts likely in q1 2015 ficci  ,0,0
love cjr,0.8999999761581421,0.8999999761581421
once ,0,0
dick cheney should be in jail read the full transcript here  ,-0.8999999761581421,0.8999999761581421
rt  for those asking â daniel padilla on pba dleague rumors hindi po totoo ang balita read here ,-0.10000000149011612,0.10000000149011612
rt   never been able to do a yoyo or hula hoop,-0.699999988079071,0.699999988079071
one person followed me  automatically checked by ,-0.5,0.5
at least i wont get that song out of my head ,0.20000000298023224,0.20000000298023224
rt  between sayang amp bae i prefer sayang idk sayang is such a beautiful word in malay ð,0.6000000238418579,0.6000000238418579
i cant accept to always be disrispected i believe i can change what i cant accept,-0.699999988079071,0.699999988079071
it was a tough battle but the win is mine!!!   ,0.8999999761581421,0.8999999761581421
new!! watch bickley somers break down cardsâ win  ,0.10000000149011612,0.5
i heard you like dolls may i present the island of dolls! ,0.20000000298023224,0.20000000298023224
best discussion i have seen thus far on  between zainab badawi and  on  ,0.8999999761581421,0.8999999761581421
uhp bright and early where ai at because gills about to get this work in,0.20000000298023224,0.20000000298023224
ððð love is in the air â¤ï¸â¤ï¸â¤ï¸ ,0.800000011920929,0.800000011920929
rt  air france pilots begin strike ,0,0
new zealand dismisses snowdens claim it planned mass domestic spying wellington reuters  new zealand was  ,-0.699999988079071,0.699999988079071
if you were keen on footy show tickets ,-0.20000000298023224,0.20000000298023224
plastic pollution choking australian waters study  link ,-0.30000001192092896,0.30000001192092896
unloving you is the hardest part,0,0
and so we know and rely on the love god has for us god is love whoever lives in love lives in god and god in ,0.800000011920929,0.800000011920929
rt  were looking for volunteers to help at the  pls rt amp get in touch if you can help! ,0.10000000149011612,0.10000000149011612
rt  this is me when all my idols are doing follow spree ð ,0.20000000298023224,0.20000000298023224
i found simple pump in the tribez amp castlez for   ,0.20000000298023224,0.20000000298023224
what are you reading lucian,-0.20000000298023224,0.20000000298023224
rt  chief keef changing his life ,-0.10000000149011612,0.10000000149011612
rt   good times,0.800000011920929,0.800000011920929
thank you for mentioning me! have an awesome day! ,0.8999999761581421,0.8999999761581421
take a short napð¤ð¤ð¤,0,0
wanna find out when you can get hold of  where you are check this out ,0.10000000149011612,0.10000000149011612
hagimit waterfalls    ,0.800000011920929,0.800000011920929
rt  my main focus is to get my shit together,-0.699999988079071,0.699999988079071
1 user i follow does not follow me back on twitter find out who does not follow you back ,-0.699999988079071,0.699999988079071
rt  brown panther jockey  after  win see gallery  ,-0.5,0.5
omg you make my smile so bright i love you can tour follow me plz x11,0.8999999761581421,0.8999999761581421
sometimes we dont realize how blessed we are to have our mothers in our lives,0.699999988079071,0.699999988079071
only 36 percent of p26trillion budget to be debated on davao rep ungab explains why ,-0.30000001192092896,0.30000001192092896
bunch of    ,-0.5,0.5
rt  miley cyrus is an outfit repeater ,0,0
no! i am ð xx,-0.10000000149011612,1.100000023841858
rt  we are on our way to meet the cast of  stay tuned for live updates and exclusive pictures ,0.30000001192092896,0.30000001192092896
rt   we believe eu founds will help to mold polish economy,0.20000000298023224,0.20000000298023224
rt  honey for the eyes virile moment         ,0.4000000059604645,0.4000000059604645
love raised by wolves edge at his best,0.8999999761581421,0.8999999761581421
ok next week ó¾© ,0.30000001192092896,0.30000001192092896
ib admit card 2014 â ib security assistant hall ticket 2014 admit cards for saexe examination oct 12 2014 ,0,0
hilarious! love the math about impact factor ,0.8999999761581421,1.899999976158142
agh! just 1 mark more and i couldve gotten a distinction! dx,0.10000000149011612,0.699999988079071
rt  adorable idea for ifwhen you have a family ð ,0.8999999761581421,0.8999999761581421
ive collected 70 gold coins!    ,0.5,0.5
rt  red sail by caras ionut ,-0.10000000149011612,0.10000000149011612
rt  lol you gotta be kidding me  ð,-0.699999988079071,0.699999988079071
feels good to workout at this time,0.8999999761581421,0.8999999761581421
for you pa! we love you! happy birthday! ,0.8999999761581421,2.700000047683716
link of the day! most popular link among people i follow is  by ,0.4000000059604645,0.800000011920929
rt  i was never going to join manchester united  muller ,-0.5,0.5
rt  great atmosphere in trinity today for freshers week! were in front square with  petition ,0.699999988079071,0.699999988079071
cheers justin just donât mention the iso this once cleaned up really well my favourite shot of the morning is,0.800000011920929,0.800000011920929
i just received a reward popular island!    ,0.800000011920929,0.800000011920929
get it out now,0,0
â someone gave me a hedgehog hat for max at my meet n greet aw look  i want one ðâ¤ï¸ð­,0.30000001192092896,0.30000001192092896
rt  at the age of 41 goalkeeper rogerio ceni scored his 120th goal for sã£o paulo last night ,0.10000000149011612,0.10000000149011612
the colombian womens cycling team stylewatch what exactly was on the mood board here sports luxe the cro ,0.5,0.5
rt  congrats  for winning this years mvp! ,0.8999999761581421,0.8999999761581421
nab alert nab alert what is the meaning of this !!!! ,-0.5,0.5
ghosts was lucky  via ,0.4000000059604645,0.4000000059604645
media monkeyâs diary page 3 scottish independence â and where is wales ,-0.20000000298023224,0.20000000298023224
rt  getting ready for church ,0.20000000298023224,0.20000000298023224
$  supplier wedges flatshoes jakarta mulai 50rb 236e6065 instagram rumahwedges ,0,0
done thanks,0.6000000238418579,0.6000000238418579
3d printing with wood filament on robo 3d printer  looks smells amp feels like wood  youtube |  ,-0.5,0.5
amp thanks! ,0.800000011920929,0.800000011920929
baekhyun  140915 incheon airport arrival from bangkok credit ,0,0
hows wallaces fitness after game,0.20000000298023224,0.20000000298023224
travel smile do you think he has got a chance  ,0,0
i am not a product of my circumstances i am a product of my decisions ,-0.6000000238418579,0.6000000238418579
1fiveðð±â¤ï¸ 2zouis 3torn 4allð 54 65sos 7noð ,0.30000001192092896,0.30000001192092896
rt  gotta love   this  is an amazing interpretation of classic porsche style ,0.8999999761581421,0.8999999761581421
napping for just 6 minutes can help improve your memory,0.5,0.5
â   nice legsðâ thanks i grew them myself,0.8999999761581421,0.8999999761581421
ive collected 37261 gold coins!    ,0.4000000059604645,0.4000000059604645
wealthy affiliate university review  crucial information helpful tips and reviews play a strategic role,0.5,0.5
life  sometimes you really are too good to me ,0.800000011920929,0.800000011920929
rt  video team usa wins gold hits the shmoney dance on the podium  ,0.10000000149011612,0.10000000149011612
too shy to talk about stis and contraception get savvy during sexual health week  1521 september 2014 ,-0.699999988079071,0.699999988079071
rt    jane   awww ang cute!! janes true friends,0.800000011920929,1.600000023841858
its twitter everybody gone have their own opinions about things that are posted,-0.30000001192092896,0.30000001192092896
never cry for someone who hurts you just smile and say thanks for giving me a chance to find someone better than you,0.4000000059604645,0.4000000059604645
rt  current mood ,0.5,0.5
rt  boa in nagoya zipfmlachic century session d ,0.699999988079071,0.699999988079071
oh my god yes! just when i thought it had gone boom it hit back even worse then before! ,0,1.7999999523162842
rt  page for more fun ,0.20000000298023224,0.20000000298023224
new job posted labor amp delivery nurse â ld rn american mobile healthcare require a âlabor amp   ,-0.30000001192092896,0.30000001192092896
thanks noona  nice to meet you,0.8999999761581421,0.8999999761581421
pick my new car up wednesday d,0.20000000298023224,0.20000000298023224
hartleys second law never sleep with anyone crazier than yourself,-0.6000000238418579,0.6000000238418579
cbb treasury bills oversubscribed by 209 ,-0.20000000298023224,0.20000000298023224
best ufo sightings april 2014 new ufos file roswell ufos documentary hd best ufo sightings april 2014  new u ,0.800000011920929,0.800000011920929
we hope you all had a nice weekend and are ready for a new week with loads of great opportunities  we thought ,0.8999999761581421,0.8999999761581421
up to 53 off saltcave session ,0,0
revs!!,0.4000000059604645,0.4000000059604645
larsfã¤lten hold business accountable for their ecological and social impact calculate the true costs ,0,0
rt  youtube users in india can now download and watch videos offline  ,0.699999988079071,0.699999988079071
you know when school year ends and you think you will stop crushing on that person during summer but you see them again and nothing changed,-0.699999988079071,0.699999988079071
rt  if you dont go after what you want you will never have it,-0.5,0.5
slingtv review convenient tv placeshifting with an underwhelming new interface for theâ¦ ,-0.5,0.5
i kennot betullah,0.4000000059604645,0.4000000059604645
welcome to gist me blog trending moviesin city a dame to kill  ,-0.4000000059604645,0.4000000059604645
you want to concentrate on the good news today rather than foc more for taurus ,-0.30000001192092896,0.30000001192092896
thank you brittanyð,0.800000011920929,0.800000011920929
news bulgaria janjuly current account posts 13pcgdp surplus ,-0.20000000298023224,0.20000000298023224
pubstomping  via ,-0.20000000298023224,0.20000000298023224
rt  literally me right nowð  ,0.30000001192092896,0.30000001192092896
constable was more than a reactionary fuddyduddy | via       ,-0.10000000149011612,0.10000000149011612
ha! uzor popsy is that your leg,0.10000000149011612,0.800000011920929
taking a shower and going back to sleep!,0.10000000149011612,0.10000000149011612
session one was calling out for a  versestill a monster of a tune tho  ,-0.10000000149011612,0.10000000149011612
rt  logo represents a house amp yellow colour represents light which carries meaning of ikon shining like a light amp fans being thâ¦,0.5,0.5
to  thanx for following me ya tha best ,0.8999999761581421,0.8999999761581421
rt  absolutely cannot wait for you guys to hear steal my girl on 29th september!,0.699999988079071,0.699999988079071
rt  derek jeter said farewell to baltimore   ,0.20000000298023224,0.20000000298023224
two ancient skeletons found holding hands in medieval chapel    ,0,0
proud to be part of the team that launched  in india!   ,0.8999999761581421,0.8999999761581421
rt  leche guys she has feelings if she hurts herself thats on everyone too,-0.5,0.5
rt  we can help you learn more about available mental health services in the community ,0.4000000059604645,0.4000000059604645
excited to be playing  this friday  ,0.8999999761581421,0.8999999761581421
this is so mehahahahaha xxxx ,0.6000000238418579,0.6000000238418579
can u direct me to places with translations for 2pms twitter junho was tweeting nonsense to the jype twitter apparently,-0.699999988079071,0.699999988079071
lmao ariana,-0.10000000149011612,0.10000000149011612
if you donât succeed at first hide all evidence that you tried,-0.5,0.5
open day session | thu 18th sept!    ,0.4000000059604645,0.4000000059604645
â ðð bruh ,0.30000001192092896,0.30000001192092896
hearts in atlantis 2001 is a pleasant movie c  ltnbxviugt,0.800000011920929,0.800000011920929
i miss my coco butter kisses,-0.20000000298023224,0.20000000298023224
dower rt 50 seconds,-0.4000000059604645,0.4000000059604645
its basically 1pt for every 300 spend so 25 x 300 = rs75k for gold status,-0.5,0.5
rt  it all comes out in the wash,0,0
rt  follow and rt  to  2 tickets to  a celebration of the history of music in cape town,0.20000000298023224,0.20000000298023224
love to save find hot designer brands for less   ,0.8999999761581421,0.8999999761581421
rt  full of sith episode lxxxii holly frey in âthereâs always room for greedoâ join tha mike pilot ,0.4000000059604645,0.4000000059604645
git windowshopping homeliness in cooperation with ecolo starry heaven coupon codes kudbfrgjl,0.30000001192092896,0.30000001192092896
unprecedented boost in number of new schools ,0.8999999761581421,0.8999999761581421
no ! jimmy protested,-0.5,1.100000023841858
euro zone trade surplus rises in july on growing exports brussels  the euro zones trade surplus rose yearo ,0,0
fav week of the school year ð,0.8999999761581421,0.8999999761581421
enigma foundation cream go fast is straight a foyer occasion lmsyzqry,0.20000000298023224,0.20000000298023224
my wedding prep pictures ,0.30000001192092896,0.30000001192092896
there is no way any one! any player in this case can man mark alexis sanchez!!!,-0.30000001192092896,0.699999988079071
â  tell your stans and groupies to fall backâ lol id like to call them  homies ð,0.10000000149011612,0.10000000149011612
just listened to the latest episode of the brilliant idiots podcast im a huge fan love what you guys do but i gotta correct,0.10000000149011612,0.10000000149011612
rt  naked game talk news is out!  stories via   ,-0.20000000298023224,0.5
rt  happy 5 birthday kyla ððððð dont be careless retweet to help me wish this girl happy birthday ðð ð ,-0.4000000059604645,0.4000000059604645
guilds ghi ,0,0
contributed tweets for  are delivered by  ,0.4000000059604645,0.4000000059604645
cannonball adderley amp miles davis â âautumn leavesâ ,0.20000000298023224,0.20000000298023224
wake iup to shirtlessni all pictures with his sunglasses and ches t ! hair!!!,0,0
rt  spirit lead me where my trust is without boarders! let me walk upon the waters wherever you would call me! ,0.5,1.100000023841858
the honor of talking to me through social networking is more than enough payment,0.4000000059604645,0.4000000059604645
i even sent her a dont let them get to you tweet,-0.699999988079071,0.699999988079071
you are eager to handle a tricky situation by quickly swinging more for pisces ,0.8999999761581421,0.8999999761581421
rt  what a show   more like best fest great to be with so many great people   ,0.8999999761581421,0.8999999761581421
sounds yummy! sweet on you day is on 27 sept 123    deatils  ,0.8999999761581421,0.8999999761581421
rt  gracias a tod victoria es vuestra! thanks to allthis victory is yours! ,0.8999999761581421,1.7999999523162842
rt  me at school ,0,0
grep me no patterns and ill tell you no lines,-0.6000000238418579,0.6000000238418579
colloidal silver salve  amazing silver balm w essential oils ,0.8999999761581421,0.8999999761581421
let us know how you get on ,0,0
preserving australias rock art  a national policy    ,0.30000001192092896,0.30000001192092896
rt  âââââ! a page turner!        ,0.699999988079071,0.699999988079071
rt    when i first found  and fell in love with   weve been married ever since ððððð ,0.8999999761581421,0.8999999761581421
i had a good bonofree run,0.8999999761581421,0.8999999761581421
follow back b2uty ,0,0
â¢ give julquen a chance â¢ give julquen a chance â¢ give julquen a chance â¢ give julquen a chance ,0.4000000059604645,0.4000000059604645
rt  owned have students own their own work more movitated  brings empowerment tangible outcomes this brings pride ,0.8999999761581421,0.8999999761581421
this is so sweet ð,0.8999999761581421,0.8999999761581421
yeah man  seriously u should come no contests amp no bangkok trips to look fwd to,-0.10000000149011612,0.10000000149011612
rt  long glass earrings bridal earrings swarovski wrapped wedding day statement piece dagger earrings  ,0.20000000298023224,0.20000000298023224
time to flee dinas again permanently moving into house in cardiff today!  ,0,0
rt   must win over patients and staff to achieve a paperless future conference hears ,0,0
rt  na every place ahdey  never expect power always  full meaning of nepa  ,-0.20000000298023224,0.20000000298023224
nah man not going on xbox yet,-0.4000000059604645,0.4000000059604645
anchorage alaska anchoragecccs on twitter  ,-0.10000000149011612,0.10000000149011612
daniele watts caught hain sex wi boyfriend in public goes off on cops but audio has nowâ¦ ,-0.699999988079071,0.699999988079071
everyone dreams ,0.8999999761581421,0.8999999761581421
rt  see how perf nashlene is the individual anniversaries are the same ya guys feel me,0,0
rt  titans collide later this year in  vs  by jim starlin  ,0,0
dinner with little brother who has no twitter thanks ,-0.4000000059604645,0.4000000059604645
lucky is the man who is the fiâ¦ ,0.800000011920929,0.800000011920929
gotta finish before its too late,-0.4000000059604645,0.4000000059604645
im here  ,0,0
yassssð whatcha mad for  ðððâï¸  ðð,0.30000001192092896,0.30000001192092896
google national park species lists facebook acquaintances,0,0
omgggg whats happeninggg,0,0
rt  terrence west is first rookie rb with at least 90 yards from scrimmage in teamâs first two games since chris johnson and â¦,0.20000000298023224,0.20000000298023224
truth y ,0.6000000238418579,0.6000000238418579
rt  your first thing in anything is unforgettable your first love first kiss first hug first friendship first job first letter â¦,0.699999988079071,0.699999988079071
rt  russian mercenaries recruited in latvia recruits for the war in ukraine are allegedly promised 1500 euro per kill ,-0.6000000238418579,0.6000000238418579
posts from enewsâ® for 09152014  ,0,0
query pitfall failure to include pages ,-0.699999988079071,0.699999988079071
ugh i wanna go home,-0.6000000238418579,0.6000000238418579
ð¤ðð¤ð meeting 5sos has been my dream for the past 3 years please make it a reality    ðð¤ðð¤39,0.699999988079071,0.699999988079071
if i stay if i stay if i stay,-0.10000000149011612,0.10000000149011612
boss simple ardor referring to propaganda bespeaking rapport dainik jagran adqspqabb ,-0.4000000059604645,0.4000000059604645
rt  is it 220 yet,0,0
what ever you do     keep your phone safe with phonehug buy now  stand b017 ,0.20000000298023224,0.20000000298023224
according to  my twitter account is worth $2784 whats yours worth  @ ,-0.30000001192092896,0.30000001192092896
rt  im so attracted to positivity,0.8999999761581421,0.8999999761581421
police tulsa man pours lighter fluid on woman ,-0.6000000238418579,0.6000000238418579
ð ð ð ð ð ð ð ð ð ð ð ð ð ð ð ð ð ð ð ð ð ð ð ð ð ð ð ð ð ð ð ð ð follow and stalk  bc gain tweets x63,-0.20000000298023224,0.20000000298023224
im trying to i just need sleep i cant stay homei love you its ok!,0.800000011920929,0.800000011920929
street art at melbourneð ,0.10000000149011612,0.10000000149011612
rt  exnigeria coach siasia on mikel âsomeone would have to talk to him but to talk to mikel you have to be ready for your oâ¦,0,0
youre rarely interested in messing around with shallow conver more for scorpio ,-0.30000001192092896,0.30000001192092896
faith is not blind i dont need wings to help me fly miracles happen once in a while when you believe âprincess diaries,-0.10000000149011612,0.10000000149011612
destiny review  gamerwho ,0,0
crrying   lmaooo rt  when baes horny but u tryna invade poland ,-0.4000000059604645,0.4000000059604645
weekly humidity   mon sep 15 213017 est 2014,0,0
rt  skin tatted up draped up in this gold three words for the way i do it âout of controlâ i gotta go to work,0,0
n   september 15 2014 at 0828pm,0,0
rt   allstar five presented by      teodosic ,0,0
im just gonna wear uggs today,-0.10000000149011612,0.10000000149011612
classdojo has made my classroom so positive! ss love it + ps so engaged! try it out!  ,0.8999999761581421,2.799999952316284
i had a dream i had a kid who was bald,0.699999988079071,0.699999988079071
rt  stage is so beautifully designed ,0.8999999761581421,0.8999999761581421
alone we can do so little together we can do so much  helen keller,0.5,0.5
thanks my friend! always great to see you,0.8999999761581421,1.899999976158142
what the facebook ipo means to  pros  ,0.10000000149011612,0.10000000149011612
one of the ways you can honor the serviceoriented virgo sun i more for leo ,0.5,0.5
rt   thanks jewish baltimore for answering your phones this afternoon we just hit the $1 million mark!,0.6000000238418579,0.6000000238418579
i would take a risk just for you,-0.699999988079071,0.699999988079071
rt  new single means new music video new pictures of the boys new reaction pics the fandom  ,0.20000000298023224,0.20000000298023224
absolutely perfected poached eggs ðð³,0.8999999761581421,0.8999999761581421
i see those brown eyes every time close mine ,-0.5,0.5
perfect tits too,0.8999999761581421,0.8999999761581421
tell them you care sometimes partners make the mistake of thinking i dont need to tell them they know but everybody needs reassurance,-0.699999988079071,0.699999988079071
okay im off to school  have a lovely day be happy and stuff stay safe! lt3,0.6000000238418579,1.2999999523162842
am i allowed too touch,0,0
